method,release,classification,repo_url,repo_commit,license,checkpoint_provenance,checkpoint_sha256,split,test_cycles,local_gate_status,full_status,paper_score_target,server_priority,claim_boundary
patch_mix_cl,1,official-like_test-selected,https://github.com/raymin0223/patch-mix_contrastive_learning,836b09fea1b70eb29fe0b25afa481286b56f5104,MIT,current author-hosted AST runtime state dict,dfc313e5082dc37ece8bd3bd6e7ea8bfee6598179a14eedd15c1727ad0af788f,official_60_40_recording,2756,source_env_data_smoke_profile_passed,pending_cuda,62.37+/-0.61,1,one seed can only be located relative to five-run distribution
pafa,1,official-like_test-selected,https://github.com/wa976/PAFA,e49e294d0db0d6af10ac46290512b9c85d3f71e1,none,non-Microsoft HF mirror BEATs_iter3+ AS2M compatibility candidate,d43cbfad4d7b56381c061d7a24774f908d4d94c72961f6eb1d9090ff18cd8d34,official_60_40_recording,2756,source_env_data_patient_smoke_profile_passed,pending_cuda,64.84+/-0.60,2,no license and official Microsoft checkpoint identity unresolved
sg_scl,2,metadata-aware_official-like_test-selected,https://github.com/kaen2891/stethoscope-guided_supervised_contrastive_learning,66564609595090b61540595d3d27764c00553086,none,current author-hosted AST runtime state dict,dfc313e5082dc37ece8bd3bd6e7ea8bfee6598179a14eedd15c1727ad0af788f,official_60_40_recording,2756,fresh_bootstrap_device_audit_smoke_prediction_wiring_passed,pending_cuda,61.71+/-1.61,3,metadata-aware not audio-only and no license
mvst,2,author-code_fixed-random-file-split_test-selected,https://github.com/wentaoheunnc/MVST,51f93fa6ffa580d0819ccb59f861582927937264,none,current author-hosted AST16 runtime artifact,dc71a6d4d07aeb7e746547f72a141f404e4c167d660bf003179f3865e06a970c,sorted_random1_file_60_40,2685,fresh_bootstrap_five_view_identity_fusion_smoke_passed,pending_cuda,66.55,4,not official ICBHI split and no license
add_rsc,2,dual_bounded_tracks,https://github.com/deegy666/ADD-RSC,e2b0f8213cb7ca451ef28757cb1329e17469fe72,none,current AST author-runtime compatibility artifact,dfc313e5082dc37ece8bd3bd6e7ea8bfee6598179a14eedd15c1727ad0af788f,official_or_sorted_random1_file,2756_or_2685,fresh_bootstrap_dual_smoke_prediction_wiring_passed,pending_cuda,65.53,5,no unique faithful protocol and no license
